title,description,link,published,source,content_type,full_content,category,processed_at,processed_tokens,text_features,word_count,sentence_count,vocab_richness
Trump pleads not guilty to 34 felony counts,,https://edition.cnn.com/webview/politics/live-news/trump-indictment-stormy-daniels-news-04-03-23/index.html,,http://rss.cnn.com/rss/edition.rss,rss,"What we covered hereFormer PresidentDonald Trumparrived in New York City Monday, a day before he is expected to turn himself in to law enforcement andface more than 30 criminal chargesin a Manhattan court following last week’s historic grand jury indictment.News outlets will not be allowedto broadcast the Tuesday arraignment, a judge ruled Monday night.Trump’s legal team said the former president will voluntarily surrender and will look tochallenge “every potential issue”once the indictment is unsealed.Trump, who has vowed to continue his 2024 bid, is the first current or former president in US history who has faced criminal charges. The district attorney’s officehas been investigatingTrump’s alleged role in a hush money payment scheme involving adult film star Stormy Daniels that dates to the 2016 presidential election. AllCatch Up34 PostsOur live coverage ofTrump’s historic indictment has moved.Link Copied!Trump arraignment has ""unparalleled public interest,"" but it won't be broadcast, judge saysFrom CNN's Tierney SneedActing New York Supreme Court Judge Juan Merchan wrote his Monday night order that the media’s request to broadcast the arraignment of former President Donald Trump was understandable, but that the news organizations’ interests in providing the broadest possible access to the proceedings must be weighed against “competing interests.”In rejecting the request to broadcast the arraignment live on television, Merchan still wrote about the historical significance of the proceeding in stark terms.“That this indictment involves a matter of monumental significance cannot possibly be disputed. Never in the history of the United States has a sitting or past President been indicted on criminal charges. Mr. Trump’s arraignment has generated unparalleled public interest and media attention,” he wrote. “The populace rightly hungers for the most accurate and current information available. To suggest otherwise would be disingenuous.”Link Copied!Judge will only briefly allow photos in the courtroom before Trump arraignment beginsFrom CNN's Tierney SneedNews outlets will not be allowed to broadcast formerPresident Donald Trump’s arraignmenton Tuesday in a New York state court, a judge said Monday night, but he will allow some photographers to take pictures in the courtroom before the proceedings formally begin.Acting New York Supreme Court Judge Juan Merchanrejected the requestby several media organizations, including CNN, for permission to broadcast the historic proceedings. Trump’s arraignment — like most arraignments in the Manhattan courthouse — is a public proceeding, but news cameras are not usually allowed to broadcast from inside the courtroom.However, the judge is allowing five pool photographers to take still photos at the beginning of the proceedings “until such time as they are directed to vacate the jury box by court personnel.”Earlier on Monday, Trump’s lawyers urged the judge to reject the media’s request for live cameras in the courtroom. The Manhattan District Attorney’s office told the judge they didn’t have a position.The media outlets that tried to get cameras into the courtroom argued that “the gravity of this proceeding … and, consequently, the need for the broadest possible public access, cannot be overstated.”Trump is now in Manhattan ahead of the arraignment.A grand jury indicted the former presidentlast week.The arraignment is also expected to bring the unsealing of the criminal charges against Trump, which have not yet been seen by his lawyers or the public.The indictment stems from Manhattan District Attorney Alvin Bragg’sinvestigationinto hush-money payments, made during the 2016 presidential campaign, to women who claimed they had extramarital affairs with Trump, which he denies.Trump denies all wrongdoing and his lawyers said last week that they’ll fight toget the charges dropped.Link Copied!Tuesday is the first test for Trump to navigate a legal and political strategyFrom CNN's Jeff ZelenyDonald Trump is not planning to speak publicly in New York on Tuesday, aides say, if he follows advice from members of his legal team who have urged the former President to refrain from the vitriol he’s been directing toward theprosecutorandjudgepresiding over the case.But that restraint does not extend to Florida, aides said, where he is planning to deliver a full-throated defense of his New York case as well asother investigations he is facingduring a prime time address from Mar-a-Lago on Tuesday night.It’s the first test to see whether Trump can navigate two vasty different approaches to hislegal caseand hispolitical campaign, which are now inextricably linked.“He’s taking this very seriously and following legal advice,” an adviser to Trump said Monday night. “He will make his case to Americans Tuesday night at Mar-a-Lago.”Link Copied!Trump is ""ready to go in and do what he needs to do tomorrow,"" attorney saysFrom CNN's Mary Kay MalloneeAlina Habba, lawyer for former President Donald Trump",unknown,2025-08-04T18:05:16.146608,cover hereform presidentdonald trumparriv new york citi monday day expect turn law enforc andfac crimin chargesin manhattan court follow last week histor grand juri indict outlet allowedto broadcast tuesday arraign judg rule monday night trump legal team former presid surrend look tochalleng potenti issu indict unseal trump vow continu bid current former presid histori face crimin charg district attorney officeha investigatingtrump alleg role hush money payment scheme involv adult film star stormi daniel date presidenti elect allcatch postsour live coverag oftrump histor indict move copi trump arraign unparallel public interest broadcast judg saysfrom tierney sneedact new york suprem court judg juan merchan wrote monday night order media request broadcast arraign former presid donald trump understand organ interest provid possibl access proceed weigh compet interest reject request broadcast arraign live televis merchan wrote histor signific proceed stark term indict involv monument signific disput histori unit state sit presid indict crimin charg trump arraign gener unparallel public interest media attent wrote populac hunger accur current inform avail suggest disingenu link copi judg briefli photo courtroom trump arraign tierney sneednew outlet allow broadcast formerpresid donald trump arraignmenton tuesday new york state court judg monday night allow photograph take pictur courtroom proceed begin act new york suprem court judg juan merchanreject requestbi sever media organ includ permiss broadcast histor proceed trump arraign arraign manhattan courthous public proceed camera allow broadcast courtroom judg allow pool photograph take photo begin proceed time direct vacat juri box court personnel monday trump lawyer urg judg reject media request live camera courtroom manhattan district attorney offic judg posit media outlet tri get camera courtroom argu graviti proceed need possibl public access overst trump manhattan arraign grand juri indict former presidentlast week arraign expect bring unseal crimin charg trump seen lawyer public indict stem manhattan district attorney alvin bragg sinvestigationinto hush money payment made presidenti campaign women claim extramarit affair trump deni trump deni wrongdo lawyer last week fight toget charg drop link copi tuesday first test trump navig legal polit strategyfrom jeff zelenydonald trump plan speak new york tuesday aid follow advic member legal team urg former presid refrain direct theprosecutorandjudgepresid case restraint extend florida aid plan full throat defens new york case investig facingdur prime time address mar lago tuesday night test see trump navig vasti differ approach hisleg caseand hispolit campaign link take follow legal advic advis trump monday night make case american tuesday night mar lago link copi trump readi need tomorrow attorney saysfrom mari kay malloneealina habba lawyer former presid donald trump,"{""word_count"": 743, ""char_count"": 5000, ""sentence_count"": 10, ""avg_word_length"": 6.002398081534772, ""vocabulary_richness"": 0.5155875299760192, ""most_common_words"": [[""trump"", 19], [""arraign"", 10], [""judg"", 9], [""indict"", 7], [""broadcast"", 7], [""proceed"", 7], [""new"", 6], [""york"", 6], [""monday"", 6], [""tuesday"", 6]]}",743,10,0.5155875299760192
Haberman reveals why Trump attacked judge and his family in speech,CNN political contributor Maggie Haberman explains the reasoning behind Donald Trump's attacks on the judge and his family during a speech at his Mar-a-Lago resort after he was arraigned on felony charges.,https://www.cnn.com/videos/politics/2023/04/05/maggie-haberman-donald-trump-speech-indictment-reaction-sot-cnntm-vpx.cnn,"Wed, 05 Apr 2023 13:30:09 GMT",http://rss.cnn.com/rss/edition.rss,rss,"Haberman reveals why Trump attacked judge and his family in speech | CNN PoliticsCNN values your feedback1. How relevant is this ad to you?2. Did you encounter any technical issues?Video player was slow to load contentVideo content never loadedAd froze or did not finish loadingVideo content did not start after adAudio on ad was too loudOther issuesAd never loadedAd prevented/slowed the page from loadingContent moved around while ad loadedAd was repetitive to ads I've seen previouslyOther issuesCancelSubmitThank You!Your effort and contribution in providing this feedback is much
                                        appreciated.CloseClose iconPoliticsTrumpFacts FirstCNN Polls2025 ElectionsMoreTrumpFacts FirstCNN Polls2025 ElectionsWatchListenLive TVSubscribeSign inMy AccountSettingsNewslettersTopics you followSign outYour CNN accountSign in to your CNN accountSign inMy AccountSettingsNewslettersTopics you followSign outYour CNN accountSign in to your CNN accountLive TVListenWatchEditionUSInternationalArabicEspañolEditionUSInternationalArabicEspañolTrumpFacts FirstCNN Polls2025 ElectionsFollow CNN PoliticsWorldAfricaAmericasAsiaAustraliaChinaEuropeIndiaMiddle EastUnited KingdomUS PoliticsTrumpFacts FirstCNN Polls2025 ElectionsBusinessTechMediaCalculatorsVideosMarketsPre-marketsAfter-HoursFear & GreedInvestingMarkets NowNightcapHealthLife, But BetterFitnessFoodSleepMindfulnessRelationshipsEntertainmentMoviesTelevisionCelebrityTechInnovateForeseeable FutureMission: AheadWork TransformedInnovative CitiesStyleArtsDesignFashionArchitectureLuxuryBeautyVideoTravelDestinationsFood & DrinkStayNewsVideosSportsFootballTennisGolfMotorsportUS SportsOlympicsClimbingEsportsHockeyScienceSpaceLifeUnearthedClimateSolutionsWeatherWeatherVideoClimateUkraine-Russia WarIsrael-Hamas WarFeaturesAs EqualsCall to EarthFreedom ProjectImpact Your WorldInside AfricaCNN HeroesWatchLive TVCNN FastShows A-ZCNN10CNN MaxCNN TV SchedulesListenCNN 5 ThingsChasing Life with Dr. Sanjay GuptaThe Assignment with Audie CornishOne ThingTug of WarCNN Political BriefingThe Axe FilesAll There Is with Anderson CooperAll CNN Audio podcastsGamesDaily CrosswordJumble CrosswordPhoto ShuffleSudoblockSudoku5 Things QuizAbout CNNPhotosInvestigationsCNN ProfilesCNN LeadershipCNN NewslettersWork for CNNHaberman reveals why Trump attacked judge and his family in speechUpdated
          9:30 AM EDT, Wed April 5, 2023Video Ad FeedbackHaberman reveals why Trump attacked judge and his family in speechLink Copied!CNN political contributor Maggie Haberman explains the reasoning behind Donald Trump's attacks on the judge and his family during a speech at his Mar-a-Lago resort after he was arraigned on felony charges.02:11- Source:CNNLatest Videos16 videosVideo Ad FeedbackHaberman reveals why Trump attacked judge and his family in speech02:11Now playing- Source:CNNVideo Ad Feedback'I thought, do or die': How a Ukrainian soldier cycled to safety after Russian assault01:55Now playing- Source:CNNVideo Ad Feedback'A human skeleton, buried alive': Brother of emaciated Israeli hostage speaks to CNN03:09Now playing- Source:CNNVideo Ad FeedbackSean ‘Diddy’ Combs’ ex asks judge to release him on bail03:09Now playing- Source:CNNVideo Ad Feedback'Racist, gerrymandered map': Texas Democrat blasts GOP-drawn congressional map03:34Now playing- Source:CNNVideo Ad Feedback'An extraordinary move': CNN reporter explains why Texas Democrats left the state01:11Now playing- Source:CNNVideo Ad FeedbackSen. Booker was asked about Democrats’ credibility. Hear his response01:37Now playing- Source:CNNVideo Ad FeedbackWhy back-to-school shopping is starting early this year02:04Now playing- Source:CNNVideo Ad FeedbackThis is how a fire cloud formed in the Grand Canyon 'megafire'01:02Now playing- Source:CNNVideo Ad Feedback'Very risky business': John Bolton reacts to Trump's nuclear subs order03:18Now playing- Source:CNNVideo Ad FeedbackSydney Sweeney's American Eagle ad campaign sparks controversy02:27Now playing- Source:CNNVideo Ad FeedbackPaul Whelan describes challenges of returning home after being imprisoned abroad04:21Now playing- Source:CNNVideo Ad FeedbackWhat Ghislaine Maxwell’s move to a lower-security federal prison camp could signal01:55Now playing- Source:CNNVideo Ad FeedbackHawaii breathes a massive sigh of relief after tsunami scare shakes island02:59Now playing- Source:CNNVideo Ad FeedbackVideo shows police arrest man accused of killing couple on a hike with kids01:11Now playing- Source:CNNVideo Ad FeedbackPassenger describes 'significant turbulence' that forced Delta flight to make emergency landing01:17Now playing- Source:CNNSee More VideosAd FeedbackSubscribeSign inMy AccountSettingsNewslettersTopics you followSign outYour CNN accountSign in to your CNN accountLive TVListenWatchWorldAfricaAmericasAsiaAustraliaChinaEuropeIndiaMiddle EastUnited KingdomUS PoliticsTrumpFacts FirstCNN Polls2025 ElectionsBusinessTechMediaCalculatorsVideosMarketsPre-marketsAfter-HoursFear & GreedInvesti",unknown,2025-08-04T18:05:16.146608,haberman reveal trump attack judg famili speech politicscnn valu feedback relev encount technic issu video player slow load contentvideo content loadedad froze finish loadingvideo content start adaudio issuesad loadedad prevent slow page loadingcont move loadedad repetit ad seen issuescancelsubmitthank effort contribut provid appreci closeclos iconpoliticstrumpfact firstcnn poll electionsmoretrumpfact firstcnn poll electionswatchlistenl tvsubscribesign inmi accountsettingsnewsletterstop followsign outyour accountsign accountsign inmi accountsettingsnewsletterstop followsign outyour accountsign accountl tvlistenwatcheditionusinternationalarabicespa oleditionusinternationalarabicespa oltrumpfact firstcnn poll electionsfollow eastunit kingdomu politicstrumpfact firstcnn poll electionsbusinesstechmediacalculatorsvideosmarketspr marketsaft hoursfear greedinvestingmarket nownightcaphealthlif betterfitnessfoodsleepmindfulnessrelationshipsentertainmentmoviestelevisioncelebritytechinnovateforese futuremiss aheadwork transformedinnov citiesstyleartsdesignfashionarchitectureluxurybeautyvideotraveldestinationsfood drinkstaynewsvideossportsfootballtennisgolfmotorsportu sportsolympicsclimbingesportshockeysciencespacelifeunearthedclimatesolutionsweatherweathervideoclimateukrain russia warisrael hama warfeaturesa earthfreedom projectimpact africacnn heroeswatchl tvcnn fastshow zcnn maxcnn scheduleslistencnn thingschas life sanjay guptath assign cornishon thingtug warcnn polit briefingth axe filesal anderson cooperal audio crosswordjumbl crosswordphoto shufflesudoblocksudoku thing cnnphotosinvestigationscnn profilescnn leadershipcnn newsletterswork cnnhaberman reveal trump attack judg famili speechupd wed april video feedbackhaberman reveal trump attack judg famili speechlink copi polit contributor maggi haberman explain reason donald trump attack judg famili speech mar lago resort arraign feloni charg sourc cnnlatest video videosvideo feedbackhaberman reveal trump attack judg famili speech play sourc cnnvideo feedback thought ukrainian soldier cycl safeti russian assault play sourc cnnvideo feedback human skeleton buri aliv brother emaci isra hostag speak play sourc cnnvideo feedbacksean diddi comb ask judg releas bail play sourc cnnvideo feedback racist gerrymand texa democrat blast gop drawn congression map play sourc cnnvideo feedback extraordinari move report explain texa democrat left state play sourc cnnvideo feedbacksen booker ask democrat credibl hear respons play sourc cnnvideo feedbackwhi school shop start earli year play sourc cnnvideo feedbackthi fire cloud form grand canyon megafir play sourc cnnvideo feedback riski busi john bolton react trump nuclear sub order play sourc cnnvideo feedbacksydney sweeney american eagl campaign spark controversi play sourc cnnvideo feedbackpaul whelan describ challeng return home imprison play sourc cnnvideo ghislain maxwel move secur feder prison camp signal play sourc cnnvideo feedbackhawaii breath massiv sigh relief tsunami scare shake island play sourc cnnvideo feedbackvideo show polic arrest man accus kill coupl hike kid play sourc cnnvideo feedbackpasseng describ signific turbul forc delta flight make emerg land play sourc cnnsee videosad feedbacksubscribesign inmi accountsettingsnewsletterstop followsign outyour accountsign accountl tvlistenwatchworldafricaamericasasiaaustraliachinaeuropeindiamiddl eastunit kingdomu politicstrumpfact firstcnn poll electionsbusinesstechmediacalculatorsvideosmarketspr marketsaft hoursfear greedinvesti,"{""word_count"": 514, ""char_count"": 5000, ""sentence_count"": 5, ""avg_word_length"": 8.789473684210526, ""vocabulary_richness"": 0.6759002770083102, ""most_common_words"": [[""sourc"", 17], [""play"", 16], [""cnnvideo"", 15], [""trump"", 6], [""judg"", 6], [""feedback"", 6], [""attack"", 5], [""famili"", 5], [""firstcnn"", 5], [""poll"", 5]]}",514,5,0.6759002770083102
What to know about the Trump indictment on the eve of his court appearance,,https://www.cnn.com/collections/intl-trump-040223/,"Wed, 05 Apr 2023 22:50:06 GMT",http://rss.cnn.com/rss/edition.rss,rss,,unknown,2025-08-04T18:05:16.146608,,"{""word_count"": 0, ""char_count"": 0, ""sentence_count"": 0, ""avg_word_length"": 0, ""vocabulary_richness"": 0, ""most_common_words"": []}",0,0,0.0
