title,description,link,published,source,content_type,full_content,category,processed_at,processed_tokens,text_features,word_count,sentence_count,vocab_richness
Texas Democrats block GOP redistricting plan by fleeing the state,"The Texas House failed to reach the quorum needed to vote on a new congressional map that could have given Republicans five new seats, after House Democrats forced a legislative standstill.",https://www.npr.org/2025/08/04/g-s1-80957/texas-redistricting-quorum-walkout,"Mon, 04 Aug 2025 17:31:22 -0400",https://feeds.npr.org/1001/rss.xml,rss,"NationalTexas Democrats block GOP redistricting plan by fleeing the stateAugust 4, 20255:31 PM ETByLiz Baker,Andrew Schneider,Ally JarmanningTexas state Rep. Jolanda ""Jo"" Jones, a Democrat, flips through maps during a public hearing on congressional redistricting in Austin, Texas, Friday, Aug. 1, 2025. After the bill passed the committee, state Democrats fled to Illinois and New York to break the quorum and stall a vote on the new maps, which heavily favor Republicans.Eric Gay/APhide captiontoggle captionEric Gay/APThe Texas House of Representatives is at a standstill after Democrats fled the state over the weekend to prevent a vote on a bill to redraw Texas's congressional maps. The billheavily favorsRepublicans with five new GOP-leaning districts, something President Trump hasopenly advocated for.Republicans control the Texas House by a wide margin, but without Democrats present, their 88 members alone fall short of the 100-member quorum required to conduct business.""To be absolutely clear, leaving the state doesn't stop this House from doing its work, it just delays it,"" Texas House Speaker Dustin Burrows told the members in the chamber after failing to reach a quorum.Sponsor MessageHe then asked for the chamber doors to be locked and quickly passed a motion for the Sergeant-at-Arms to issue civil arrest warrants for unexcused, absent House members.Many of the missinglawmakers fledto Democratic strongholds New York and Illinois rather than show up in the Texas Capitol in Austin for a vote they were certain to lose.""This is like two football teams coming out of the locker room at halftime and the team that's ahead says they want to change the rules for the second half because they want to win the game,"" State Rep. James Talarico (D-Austin)told NPRfrom Illinois, where he is waiting out the quorum-break.PoliticsTexas Democrats walked out to block the GOP. How well has the tactic worked before?""I mean, we all recognize that as cheating, plain and simple. And if the Republicans are going to cheat, Texas Democrats are not going to play.""Texas Gov. Greg Abbott saidin a statementthat the quorum-breaking Democrats should ""behave like adults, rather than going AWOL,"" and should be expelled from office.On Monday, after the failed House session, he said he hadorderedthe Texas Department of Public Safety to ""locate, arrest, and return to the House chamber any member who has abandoned their duty to Texans.""Sponsor MessageRepublican state Attorney General Ken Paxton, who is running for a U.S. Senate seat,said in a press releasethat the current legal framework ""allows for rogue lawmakers to be found, arrested, and brought back to the Capitol.""Two Texas lawmakers attending the National Conference of State Legislatures in Boston spent Monday speaking to reporters and warning their colleagues in other states of what may be coming for them, too.""It's Texas now, but it's going to continue through the rest of the states, and it's going to kill our democracy,"" Rep. Ana Hernandez told reporters.She and fellow Democrat Rep. Armando Walle were both planning to come to Boston before the bill was called in Texas. They plan to stay out of Texas until the special session ends Aug. 19.State Reps. Armando Walle, left, and Ana Hernandez, both Democrats from Houston, speak during a news conference at the National Conference of State Legislatures Summit, in Boston. They plan to stay out of state until the special session wraps up on August 19th.Michael Dwyer/APhide captiontoggle captionMichael Dwyer/APIn New York, where several of the Texas Democrats decamped to avoid arrest, Gov. Kathy Hochul held a press conference in support of the lawmakers, indicating that her majority-blue state would explore redrawing its own electoral map. Given the state's constitution, that may not be likely until 2027 or beyond.""If Republicans are willing to rewrite these rules to give themselves an advantage, then they're leaving us no choice; we must do the same,""Hochul stated.Redistricting usually occurs after a census, andmid-decade redrawslike this one in Texas are rare, but other states, including California and Missouri, are pushing for redistricting in their own attempts to lock in partisan advantages. Ohio, which went heavily for Trump, is redistricting this year due to a 2018 state law.This attempt by Texas Republicans was inserted into a special legislative session called by Gov. Abbott to address thedeadly Hill Country floodsthat killed at least 136 people last month, which Texas Democrats decry as a bait-and-switch.""Gov. Abbott has used this tragedy, taken these families who are grieving, taken these communities who are struggling to recover, and used them as hostages in a political game,"" said state House Democratic Caucus Chair Gene Wu.Sponsor Message""This vote is a profound act of contempt for the people of Texas. It is the final confirmation that to hold power, Republicans will gladly silence the voices of Black and Latino Texans who have fough",unknown,2025-08-04T18:05:16.146608,nationaltexa democrat block gop redistrict plan flee stateaugust etbyliz baker andrew alli jarmanningtexa state rep jolanda jone democrat flip map public hear congression redistrict austin texa friday aug bill pass committe state democrat fled illinoi new york break quorum stall vote new map favor republican eric gay aphid captiontoggl captioner gay texa hous repres standstil democrat fled state weekend prevent vote bill redraw texa congression map favorsrepublican new gop lean district someth presid trump advoc republican control texa hous wide margin democrat present member fall short member quorum requir conduct busi clear leav state stop hous work delay texa hous speaker dustin burrow member chamber fail reach quorum sponsor messageh ask chamber door lock pass motion sergeant arm issu civil arrest warrant unexcus absent hous member mani missinglawmak fledto democrat stronghold new york illinoi show texa capitol austin vote certain lose footbal team come locker room halftim team want chang rule second half want win game state rep jame talarico nprfrom illinoi wait quorum break politicstexa democrat walk block gop tactic work mean recogn cheat simpl republican go cheat texa democrat go play texa gov greg abbott saidin quorum break democrat behav adult go awol expel offic monday fail hous session hadorderedth texa depart public safeti locat arrest return hous chamber member abandon duti texan sponsor messagerepublican state attorney gener ken paxton run senat seat current legal framework allow rogu lawmak found arrest brought capitol texa lawmak attend nation confer state legislatur spent monday speak report warn colleagu state come texa go continu rest state go kill democraci rep ana hernandez report fellow rep armando plan come boston bill call texa plan stay special session end aug state rep armando wall left ana hernandez democrat houston speak confer nation confer state legislatur summit boston plan stay state special session wrap august michael dwyer captiontoggl captionmichael dwyer apin new york sever texa democrat decamp avoid arrest gov kathi hochul held confer support lawmak indic major blue state explor redraw elector map given state constitut republican will rewrit rule give advantag leav choic hochul state redistrict occur censu andmid decad texa rare state includ california missouri push redistrict attempt lock partisan advantag ohio went trump redistrict year due state law attempt texa republican insert special legisl session call gov abbott address hill countri kill peopl last month texa democrat decri bait switch gov abbott use tragedi taken famili griev taken commun struggl recov use hostag polit game state hous democrat caucu chair gene sponsor messag vote act contempt peopl texa final confirm hold power republican silenc voic black latino texan fough,"{""word_count"": 780, ""char_count"": 5000, ""sentence_count"": 22, ""avg_word_length"": 5.580419580419581, ""vocabulary_richness"": 0.6153846153846154, ""most_common_words"": [[""state"", 18], [""texa"", 17], [""democrat"", 13], [""hous"", 8], [""republican"", 6], [""redistrict"", 5], [""rep"", 5], [""new"", 5], [""quorum"", 5], [""member"", 5]]}",780,22,0.6153846153846154
Wildfire smoke is like smoking 'half a pack a day.' Here's how to protect yourself,As Canadian wildfires spread smoke across the U.S. the air pollution is dangerous to health. But there are ways to protect yourself. Here's what to know<strong>.</strong>,https://www.npr.org/2025/08/04/nx-s1-5492448/health-michigan-canada-smoke-minnesota-air-quality-wildfire,"Mon, 04 Aug 2025 17:08:25 -0400",https://feeds.npr.org/1001/rss.xml,rss,"ClimateWildfire smoke is like smoking 'half a pack a day.' Here's how to protect yourselfAugust 4, 20255:08 PM ETByAlejandra Borunda,Julia SimonPeople play rugby in the hazy weather on July 27, 2025 in New York City. There are currently smoke advisories across the Midwest and Northeast as a result of wildfires in Canada.Liao Pan/China News Service/VCG via Getty Imageshide captiontoggle captionLiao Pan/China News Service/VCG via Getty ImagesThis story is updated to reflect the current wildfire smoke conditions in the U.S. The original story was publishedJan. 8, 2025.Smoke from Canadian wildfires continued to prompt air quality alerts Monday in the Northeast U.S. as well as the Upper Midwest.Michigan saw astatewide air quality advisoryon Monday, and while Minnesota is seeing some relief, the wildfire smoke ispersisting in Wisconsin, andspreading across New York,Vermont, andMaine.Canada is experiencing its second worst wildfire season on record, according to government data. There have been nearly 4,000 fires recorded already this calendar year.Sponsor MessageExposure to wildfire smoke is a growing health problem across the country, as human-caused climate change increases the risk and intensity of wildfires and the smoke that can drift thousands of miles downwind from them.Here's what you need to know about the health risks — and how to protect yourself.The health risks of breathing wildfire smokeMay-Lin Wilgus, a pulmonologist and professor at UCLA, compares breathing wildfire smoke to smoking cigarettes – a lot of cigarettes.Scientists track air quality with theair quality index, or AQI, which incorporates different pollution sources like ozone and fine particulates. Many scientists don't think there's a ""safe"" AQI level becausethe measurement doesn't capture many harmful pollutants, but under 50 is often considered acceptable. Higher numbers indicate more health-damaging pollution in the air.OnMonday the AQI in Detroit was at least 159. On a smoky day, when AQI levels reach 100 to 200, ""the exposure to the fine particulate matter, the air pollution, is similar to smoking aquarter to half a pack a day,"" Wilgus says.That exposure takes a toll on a healthy person. But it is particularly harmful for those with pre-existing health issues, Wilgus adds. Emergency room visits for respiratory issues like asthma and COPDincrease dramaticallyduring wildfire smoke events, as much asdoubling in somecases. During the Canadian wildfires in 2023, when smoke wafted across much of the U.S., emergency room visits for asthmaincreased by nearly 20%.Sponsor MessageSmoke exposure can alsoworsen other medical conditions. Emergency departments see morecardiovascularrelated visits after smoky days. And a growing body of research suggests smoke exposure is linked to long-term impacts such as a higher risk ofdeveloping dementia.Overall, air quality has improved in the U.S. over the past 20 years, says Tarik Benmarhnia, a climate and health scientist at the Scripps Institution of Oceanography at the University of California, San Diego. But wildfire smoke iserasing many of those gains.""Just maybe like ten years ago wildfire was an exceptional issue. It was something that happens once in a lifetime for most people,"" he says.But climate change has increased the chance of wildfires across many parts of the country, and the intensity of many of the burns themselves and the smoke they produce.""This is unfortunately not the first one and not the last one the people in Los Angeles are going to be experiencing,"" Benmarhnia says.Wondering what AQI is safe and what activities are safe at different AQIs? Life Kitexplains.The dangers of breathing wildfire smokeWildfires burn at extremely high temperatures, which makes their ash more toxic than other pollution, such as car exhaust. But in many cases, including during these ongoing fires,it's not just trees and organic matter that burn. Homes, cars and other materials go up in flames, too, adding potentially harmful particles to the pollution load.""It's just a toxic soup,"" says Lisa Miller, a wildfire smoke expert at the University of California, Davis. ""Think of all the synthetic fibers that are present in your living room – in your couch, in your carpet, in your clothes. All those things can be particularly toxic"" if they go up in smoke, she says.Higher risks for some peopleWildfire smoke is hazardous for everyone, but it's especially dangerous for some people, including children and older adults, pregnant people and anyone with preexisting health problems.Sponsor MessageFirst responders and firefighters are exposed to the worst of the smoke. A 2019 study found that heavy, repeated smoke exposure among wildland firefighters is linked withhigher risks of lung cancer and cardiovascular disease.Children can beespecially vulnerable, doctors say, because they breathe in more air – and therefore more smoke – relative to their body size.Pregnant people should also take care, says Miller. There's growing ",unknown,2025-08-04T18:05:16.146608,climatewildfir smoke smoke half pack day protect yourselfaugust etbyalejandra borunda julia simonpeopl play rugbi hazi weather juli new york citi smoke advisori northeast result wildfir canada liao pan china servic vcg getti imageshid captiontoggl captionliao china servic vcg getti imagesthi stori updat reflect current wildfir smoke condit origin stori publishedjan smoke canadian wildfir continu prompt air qualiti alert monday upper michigan saw air qualiti advisoryon monday minnesota see relief wildfir smoke ispersist wisconsin andspread new york vermont canada experienc second wildfir season record govern data fire record calendar year sponsor messageexposur wildfir smoke grow health problem countri human caus climat chang increas risk intens wildfir smoke drift thousand mile need know health risk protect health risk breath wildfir smokemay lin wilgu pulmonologist professor ucla compar breath wildfir smoke smoke cigarett lot cigarett scientist track air qualiti theair qualiti index aqi incorpor differ pollut sourc ozon fine particul mani scientist think safe aqi level becauseth measur captur mani harm pollut consid accept number indic health damag pollut air onmonday aqi detroit smoki day level reach exposur fine particul matter air pollut similar smoke aquart half pack day wilgu exposur take toll healthi person harm pre exist health issu wilgu add emerg room visit respiratori issu asthma copdincreas dramaticallydur wildfir smoke event much asdoubl somecas canadian wildfir smoke waft much emerg room visit asthmaincreas sponsor messagesmok exposur alsoworsen medic condit emerg depart see morecardiovascularrel visit smoki day grow bodi research suggest smoke exposur link long term impact risk ofdevelop dementia overal air qualiti improv year tarik climat health scientist scripp institut oceanographi univers california san diego wildfir smoke iseras mani gain year wildfir except issu someth happen lifetim peopl climat chang increas chanc wildfir mani part countri intens mani burn smoke produc last peopl lo angel go experienc benmarhnia wonder aqi safe activ safe differ aqi life kitexplain danger breath wildfir smokewildfir burn high temperatur make ash toxic pollut car mani case includ ongo fire tree organ matter burn home car materi ad harm particl pollut load toxic soup lisa miller wildfir smoke expert univers california davi think synthet fiber present live room couch carpet cloth thing smoke risk peoplewildfir hazard everyon danger peopl includ children adult pregnant peopl anyon preexist health problem sponsor messagefirst respond firefight expos smoke studi found heavi repeat smoke exposur wildland firefight link withhigh risk lung cancer cardiovascular diseas children vulner doctor breath air smoke rel bodi size pregnant peopl take care miller grow,"{""word_count"": 757, ""char_count"": 5000, ""sentence_count"": 26, ""avg_word_length"": 5.891891891891892, ""vocabulary_richness"": 0.6191646191646192, ""most_common_words"": [[""smoke"", 21], [""wildfir"", 16], [""air"", 7], [""health"", 7], [""risk"", 6], [""pollut"", 6], [""mani"", 6], [""qualiti"", 5], [""aqi"", 5], [""exposur"", 5]]}",757,26,0.6191646191646192
The Global Impact of the Latest U.S. Tariffs,"<p class=""readrate"">The Trump Administration’s worldwide tariff wars continue.  A top priority for Trump has been resetting U.S. trade relations and earlier this year his administration had vowed “90 deals in 90 days”. But as the August 1st deadline came and went, what emerged wasn’t a flurry of deals but a wave of new tariffs.  We hear from reporters around the world about how countries are reacting to the news and what the impact could be.",https://www.npr.org/2025/08/04/nx-s1-5492483/the-global-impact-of-the-latest-u-s-tariffs,"Mon, 04 Aug 2025 16:49:02 -0400",https://feeds.npr.org/1001/rss.xml,rss,"State of the World from NPRNPRState of the World from NPRLISTEN & FOLLOWNPR AppApple PodcastsSpotifyAmazon MusiciHeart RadioYouTube MusicRSS linkThe Global Impact of the Latest U.S. TariffsAugust 4, 20254:49 PM ETByJackie Northam,Kate Bartlett,Jane Arraf,Michael Sullivan,Greg DixonThe Global Impact of the Latest U.S. TariffsListen·7:237:23Toggle more optionsDownloadEmbedEmbed<iframe src=""https://www.npr.org/player/embed/nx-s1-5492483/nx-s1-9397225"" width=""100%"" height=""290"" frameborder=""0"" scrolling=""no"" title=""NPR embedded audio player"">Shipping containers sit stacked at the Evergreen terminal at the port of Los Angeles, Friday, Aug. 1, 2025.Damian Dovarganes/ APhide captiontoggle captionDamian Dovarganes/ APThe Trump Administration’s worldwide tariff wars continue.  A top priority for Trump has been resetting U.S. trade relations and earlier this year his administration had vowed “90 deals in 90 days”. But as the August 1st deadline came and went, what emerged wasn’t a flurry of deals but a wave of new tariffs.  We hear from reporters around the world about how countries are reacting to the news and what the impact could be.Sponsor MessageFacebookFlipboardEmail The Global Impact of the Latest U.S. TariffsListen·7:237:23Toggle more optionsDownloadEmbedEmbed<iframe src=""https://www.npr.org/player/embed/nx-s1-5492483/nx-s1-9397225"" width=""100%"" height=""290"" frameborder=""0"" scrolling=""no"" title=""NPR embedded audio player"">",unknown,2025-08-04T18:05:16.146608,state world nprnprstate world nprlisten follownpr appappl podcastsspotifyamazon musiciheart radioyoutub musicrss linkth global impact tariffsaugust etbyjacki northam kate bartlett jane michael sullivan greg dixonth global impact tariffslisten toggl optionsdownloadembedemb ifram src width height scroll titl npr embed audio player ship contain sit stack evergreen termin port lo angel friday aug damian dovargan captiontoggl captiondamian dovargan apth trump administr tariff war continu top prioriti trump reset trade relat year administr vow deal day august deadlin came went emerg flurri deal wave new tariff hear report world countri react impact sponsor messagefacebookflipboardemail global impact tariffslisten toggl optionsdownloadembedemb ifram src width height scroll titl npr embed audio player,"{""word_count"": 169, ""char_count"": 1444, ""sentence_count"": 4, ""avg_word_length"": 6.666666666666667, ""vocabulary_richness"": 0.7619047619047619, ""most_common_words"": [[""impact"", 4], [""world"", 3], [""global"", 3], [""tariffslisten"", 2], [""toggl"", 2], [""optionsdownloadembedemb"", 2], [""ifram"", 2], [""src"", 2], [""width"", 2], [""height"", 2]]}",169,4,0.7619047619047619
Brazil's top court orders house arrest for Bolsonaro,"Brazil's Supreme Court ordered house arrest for former President Jair Bolsonaro, who is standing trial for allegedly plotting a coup.",https://www.dw.com/en/brazil-s-top-court-orders-house-arrest-for-bolsonaro/a-73528626?maca=en-rss-en-all-1573-rdf,,https://rss.dw.com/rdf/rss-en-all,rss,"CrimeBrazilBrazil's top court orders house arrest for BolsonaroKate Hairsinewith Reuters, AP08/05/2025August 5, 2025Brazil's Supreme Court ordered house arrest for former President Jair Bolsonaro, who is standing trial for allegedly plotting a coup.https://p.dw.com/p/4yW9aFormer President Jair Bolsonaro has already been fitted with an ankle monitorImage: Eraldo Peres/AP Photo/picture allianceAdvertisementBrazil's Supreme Court on Monday ordered the house arrest ofJair Bolsonaro.The former president is standing trial for allegedly leading a coup attempt after losing the 2022 electiontoLuiz Inacio Lula da Silva.Why has the court ordered house arrest?Justice Alexandre de Moraes, who is overseeing the case against Bolsonaro in court, issued the order.He said in his decision that Bolsonaro had violated the precautionary measures imposed on him in July thatbarred the far right leader from using social media.As well as ordering house arrest, Moraes also bannedthe 70-year-oldfrom receiving visits, with exceptions for lawyers and people authorized by the court.He also ordered the seizure of mobile phones from Bolsonaro's home in Rio de Janeiro.Brazil: Mass rally backs amnesty for far-right BolsonaroTo view this video please enable JavaScript, and consider upgrading to a web browser thatsupports HTML5 videoMore to come....Edited by:Srinivas MazumdaruKate HairsineReporter and senior editorSend us your feedbackYour feedback",unknown,2025-08-04T18:05:16.146608,crimebrazilbrazil top court order hous arrest bolsonarok hairsinewith august brazil suprem court order hous arrest former presid jair stand trial plot coup presid jair bolsonaro fit ankl monitorimag eraldo pere photo pictur allianceadvertisementbrazil suprem court monday order hous arrest ofjair bolsonaro former presid stand trial lead coup attempt lose electiontoluiz inacio lula silva court order hous arrest justic alexandr mora overse case bolsonaro court issu order decis bolsonaro violat precautionari measur impos thatbar right leader use social media order hous arrest mora bannedth year receiv visit except lawyer peopl author court order seizur mobil phone bolsonaro home rio janeiro brazil mass ralli back amnesti right bolsonaroto view video pleas enabl javascript consid upgrad web browser thatsupport html come edit sriniva mazumdaruk hairsinereport senior editorsend feedbackyour feedback,"{""word_count"": 193, ""char_count"": 1435, ""sentence_count"": 1, ""avg_word_length"": 6.190476190476191, ""vocabulary_richness"": 0.7301587301587301, ""most_common_words"": [[""order"", 7], [""court"", 6], [""hous"", 5], [""arrest"", 5], [""bolsonaro"", 5], [""presid"", 3], [""brazil"", 2], [""suprem"", 2], [""former"", 2], [""jair"", 2]]}",193,1,0.7301587301587301
