title,description,link,published,source,content_type,full_content,category,processed_at,processed_tokens,text_features,word_count,sentence_count,vocab_richness
"He is a human skeleton, Gaza hostage's brother tells BBC","Ilay David says the Hamas video showing his brother Evyatar emaciated and weak is a ""new form of cruelty"" that has left his parents shattered.",https://www.bbc.com/news/articles/cewyk4ezeedo?at_medium=RSS&at_campaign=rss,"Mon, 04 Aug 2025 17:05:21 GMT",http://feeds.bbci.co.uk/news/rss.xml,rss,"He is a human skeleton, Gaza hostage's brother tells BBC6 hours agoShareSaveJon DonnisonBBC NewsReporting fromJerusalemPaulin KolaBBC NewsReporting fromLondonShareSave'It's a new kind of cruelty', says Gaza hostage's brotherThe brother of an Israeli hostage held in the Gaza Strip has told the BBC that a Hamas video showing him emaciated and weak is a ""new form of cruelty"" that has left his parents shattered.Hamas released the footage of Evyatar David, 24, on Saturday, drawing strong condemnation from Israel and Western leaders.""He's a human skeleton. He was being starved to the point where he can be dead at any moment, and he suffers a great deal. He barely can't speak, he barely can move,"" David's brother Ilay said in an interview on Monday.In the video, Evyatar says: ""I haven't eaten for days... I barely got drinking water."" He is seen digging what he says will be his own grave.OtherA still showing Israeli hostage Evyatar David being held in a Gaza tunnel from the video released by HamasHostages' families have urged Prime Minister Benjamin Netanyahu to prioritise their release as reports suggest he might be planning to expand the military campaign.The footage of Evyatar was released after Palestinian Islamic Jihad published video of another hostage, Rom Braslavski, thin and crying.Both men were abducted from the Nova music festival during the Hamas-led attack on southern Israel on 7 October 2023.They are among 50 hostages still being held in Gaza, 20 of whom are believed to be alive.Ilay David said his father had barely recognised his son Evyatar's voice on the video and had not been able to sleep. He said his mother cried all day.""Seeing those images of my brother as a human skeleton, we understood it's, it's, it's a new kind of cruelty,"" Mr David said. ""It's the lowest you can get.""He called on world leaders to unite to save him and other hostages ""from the cruel, twisted hands of Hamas"".""So we have to be so focused on delivering the message, which is, Evyatar is dying, we need to give him medicine, to give him food, proper food, and you need to get this treatment now, or else will die.""Hamas's armed wing has denied it intentionally starves prisoners, saying hostages eat what their fighters and people in Gaza eat.Ilay DavidEvyatar David (L) with his brother Ilay shown here in happier timesHundreds of Israeli ex-officials appeal to Trump to help end Gaza warWorld leaders condemn videos of emaciated Israeli hostages in Gaza as Red Cross calls for accessFamine 'currently playing out' in Gaza, UN-backed experts warnAfter the hostages' videos were released, Netanyahu spoke with their families, telling them that efforts to return all the hostages ""will continue constantly and relentlessly"".But an Israeli official - widely quoted by local media - said Netanyahu was working to free the hostages through ""the military defeat of Hamas"".The possibility of a new escalation in Gaza may further anger Israel's allies who have been pushing for an immediate ceasefire as reports of Palestinians dying from starvation or malnutrition cause shock around the world.The main group supporting hostages' families condemned the idea of a new military offensive saying: ""Netanyahu is leading Israel and the hostages to doom.""That view was pointedly made in a letter by some 600 retired Israeli security officials sent to US President Donald Trump urging him to pressure Israel to immediately end the war in Gaza.""Your credibility with the vast majority of Israelis augments your ability to steer Prime Minister [Benjamin] Netanyahu and his government in the right direction: End the war, return the hostages, stop the suffering,"" they wrote.The group included former Mossad chief Tamir Pardo, Ami Ayalon, former chief of Shin Bet - Israel's domestic secret service agency - former Prime Minister Ehud Barak, and former Defence Minister Moshe Yaalon among others.""It is our professional judgement that Hamas no longer poses a strategic threat to Israel,"" they said.""At first this war was a just war, a defensive war, but when we achieved all military objectives, this war ceased to be a just war,"" said Ayalon.The former top leaders head the Commanders for Israel's Security (CIS) group, which has urged the government in the past to focus on securing the return of the hostages.""Stop the Gaza War! On behalf of CIS, Israel's largest group of former IDF generals and Mossad, Shin Bet, Police, and Diplomatic Corps equivalents, we urge you to end the Gaza war. You did it in Lebanon. Time to do it in Gaza as well,"" they wrote to the US president.OtherA still of a video released by Palestinian Islamic Jihad showing hostage Rom BraslavskiIsrael launched a devastating war in Gaza following Hamas's 7 October attack in which about 1,200 people were killed and 251 taken into Gaza as hostages.More than 60,000 people have been killed as a result of Israel's military campaign in Gaza since 7 October, the Hamas-run health ministry says.On Monday, the ministry reported th",unknown,2025-08-04T18:05:16.146608,human skeleton gaza hostag brother tell hour agosharesavejon donnisonbbc newsreport fromjerusalempaulin kolabbc newsreport fromlondonsharesav new kind cruelti gaza hostag brotherth brother isra hostag held gaza strip hama video show emaci weak new form cruelti left parent shatter hama releas footag evyatar david saturday draw strong condemn israel western leader human skeleton starv point dead moment suffer great deal speak move david brother ilay interview monday video evyatar eaten day got drink water seen dig grave othera show isra hostag evyatar david held gaza tunnel video releas hamashostag famili urg prime minist benjamin netanyahu prioritis releas suggest plan expand militari campaign footag evyatar releas palestinian islam jihad publish hostag rom braslavski cri men abduct nova music festiv hama led attack southern israel octob hostag held gaza believ aliv ilay david recognis son evyatar voic video abl sleep mother cri day see imag human skeleton understood new kind cruelti david get call world leader unit save hostag cruel twist hand hama focus deliv messag evyatar die give medicin give food proper food need get treatment die hama arm wing deni starv prison say hostag eat fighter peopl gaza eat ilay davidevyatar david brother ilay shown timeshundr isra offici appeal trump help end gaza warworld leader condemn emaci isra hostag gaza red cross call accessfamin play gaza back expert warnaft hostag video releas netanyahu spoke famili tell effort return hostag continu isra offici quot local media work free hostag militari defeat hama possibl new escal gaza anger israel alli push immedi ceasefir palestinian die starvat malnutrit caus shock world main group support hostag famili condemn idea new militari offens say netanyahu lead israel hostag doom view made letter retir isra secur offici sent presid donald trump urg pressur israel end war gaza credibl vast major isra augment abil steer prime minist benjamin netanyahu govern right direct end war return hostag stop suffer wrote group includ former mossad chief tamir pardo ami ayalon former chief shin bet israel domest secret servic agenc former prime minist ehud barak former defenc minist mosh yaalon other profession judgement hama pose strateg threat israel first war war defens war achiev militari object war ceas war ayalon former top leader head command israel secur ci group urg govern focu secur return hostag stop gaza war behalf ci group former idf gener mossad shin bet polic diplomat corp equival urg end gaza war lebanon time gaza wrote presid othera video releas palestinian islam jihad show hostag rom braslavskiisrael launch devast war gaza follow hama octob attack peopl kill taken gaza hostag peopl kill result israel militari campaign gaza octob hama run health ministri monday ministri report,"{""word_count"": 813, ""char_count"": 5000, ""sentence_count"": 20, ""avg_word_length"": 5.426605504587156, ""vocabulary_richness"": 0.5688073394495413, ""most_common_words"": [[""hostag"", 18], [""gaza"", 17], [""war"", 10], [""hama"", 9], [""israel"", 9], [""isra"", 7], [""video"", 6], [""releas"", 6], [""evyatar"", 6], [""david"", 6]]}",813,20,0.5688073394495413
UK-French small boats pilot plan comes into force,"The 'one-in, one-out' deal will see some of those arriving in the UK returned to France.",https://www.bbc.com/news/articles/cewykzegy4qo?at_medium=RSS&at_campaign=rss,"Mon, 04 Aug 2025 21:34:23 GMT",http://feeds.bbci.co.uk/news/rss.xml,rss,"UK-French small boats pilot plan comes into force2 hours agoShareSaveShareSaveEPAThe UK-French ""one-in, one-out"" pilot scheme, aimed at reducing the number of small boats crossing the Channel, has come into force with detentions of illegal migrants due to start within days.The deal will see some of those arriving in the UK in small boats detained and returned to France.In exchange the UK will accept from France an equal number of asylum seekers provided they have not already tried to make the crossing and can pass security and eligibility checks.Prime Minister Sir Keir Starmer said the plan was a ""product of months of grown-up diplomacy"" which would ""deliver real results"".But the Conservatives said it would ""make no difference whatsoever"".Sir Keir and French President Emmanuel Macron announced the agreement in July, but it was still subject to legal scrutiny by the European Commission and EU member states.The UK government has now said that the ""EU Commission, Germany and other member states have given the green light on this innovative approach"" meaning the scheme can go ahead.Under the plan, an adult migrant who tries to get to the UK by crossing the Channel could be returned to France if their claim for asylum is deemed to be inadmissible. Returns could begin to take place within weeks.UK and international law prevents the government from sending asylum seekers back to their country of origin before their claim has been considered and turned down. However, they can be sent to safe countries prepared to consider their claim.How many people cross the Channel in small boats?'One in, one out' sounds simple - but the migrant deal could be complicatedExtra 300 officers to tackle small boat people smugglingThe government has not confirmed how many migrants would be returned and accepted under the plan, but said it would look to ""ramp up both the pace and scale of returns over the course of the pilot scheme"".There have been reports that 50 people per week could be returned, compared to the weekly average of more than 800 people currently making the crossing.Sir Keir has previously said the pilot is not ""a silver bullet"" but believes it will deter people from making the dangerous journey following a big increase in the numbers so far this year.As of 30 July, more than 25,000 people had crossed the Channel in small boats in 2025 - around 49% higher than at the same point in 2024.The government is under pressure to reduce the numbers, having previously promised to ""smash the gangs"" organising the journeys.Home Secretary Yvette Cooper hailed the agreement as ""ground breaking"" and an ""important step towards undermining the business model of the organised crime gangs"".""It is also right to make clear that – while the UK will always be ready to play its part alongside other countries in helping those fleeing persecution and conflict – this must be done in a controlled and managed legal way, not through dangerous, illegal, and uncontrolled routes,"" she said.On Monday, the government announced £100m to fund 300 National Crime Agency Officers to stop the people smugglers arranging the crossings.It has also said it wants to tackle illegal working, to reduce pull factors encouraging people to come to the UK.Conservative shadow home secretary Chris Philp said the government's deal with the French would be less effective than the Rwanda plan, proposed by the previous Conservative government.""The Rwanda removals deterrent, under which 100% of illegal arrivals would be removed, was ready to go last summer but Labour cancelled it just days before it was due to start with no proper replacement plan,"" he said.""As a result, this year so far has been the worst ever for illegal immigrants crossing the Channel.""When the UK and France first announced the plan in July, the charity Asylum Matters criticised the measure, arguing: ""The only way to stop people from making dangerous journeys is to give them real safe routes to seek sanctuary.""Migration",unknown,2025-08-04T18:05:16.146608,french small boat pilot plan come forc hour agosharesavesharesaveepath french pilot scheme aim reduc number small boat cross channel come forc detent illeg migrant due day deal see arriv small boat detain return franc exchang accept franc equal number asylum seeker provid tri make cross pass secur elig check prime minist sir starmer plan product month grown diplomaci deliv real result conserv make differ sir french presid emmanuel macron announc agreement juli subject legal scrutini european commiss member state govern commiss germani member state given green light innov approach mean scheme plan adult migrant tri get cross channel return franc claim asylum deem inadmiss return begin take place week intern law prevent govern send asylum seeker countri origin claim consid turn sent safe countri prepar claim mani peopl cross channel small boat sound simpl migrant deal complicatedextra offic tackl small boat peopl smugglingth govern confirm mani migrant return accept plan look ramp pace scale return cours pilot scheme peopl week return compar weekli averag peopl make cross sir keir pilot silver bullet believ deter peopl make danger journey follow big increas number year peopl cross channel small boat point govern pressur reduc number promis smash gang organis journey home secretari yvett cooper hail agreement ground break import step toward undermin busi model organis crime gang make clear readi play part countri help flee persecut conflict done control manag legal way danger illeg uncontrol rout monday govern announc nation crime agenc offic stop peopl smuggler arrang cross want tackl illeg work reduc pull factor encourag peopl come conserv shadow home secretari chri philp govern deal french less effect rwanda plan propos previou conserv govern rwanda remov deterr illeg arriv remov readi last summer labour cancel day due start proper replac plan result year worst illeg immigr cross channel franc announc plan chariti asylum matter criticis measur argu way stop peopl make danger journey give real safe rout seek sanctuari migrat,"{""word_count"": 650, ""char_count"": 3990, ""sentence_count"": 9, ""avg_word_length"": 5.4576802507836994, ""vocabulary_richness"": 0.6050156739811913, ""most_common_words"": [[""peopl"", 9], [""cross"", 8], [""plan"", 7], [""govern"", 7], [""small"", 6], [""boat"", 6], [""return"", 6], [""make"", 6], [""channel"", 5], [""illeg"", 5]]}",650,9,0.6050156739811913
Storm Floris batters UK with winds over 80mph,"An amber warning covers most of Scotland and there is a yellow warning in parts of England, Wales and Northern Ireland.",https://www.bbc.com/news/articles/c4gq3n049jno?at_medium=RSS&at_campaign=rss,"Mon, 04 Aug 2025 22:49:37 GMT",http://feeds.bbci.co.uk/news/rss.xml,rss,"Storm Floris batters UK with winds over 80mph14 minutes agoShareSaveRachel Muller-HeyndykBBC NewsElizabeth RizziniLead weather presenterShareSaveDamage and disruption as Storm Floris crashes into UKTravel disruption is expected to continue on Tuesday after Storm Floris battered parts of the country with 80mph winds.Scotland bore the brunt of the bad weather with some 43,500 homes without power on Monday night. Planes, trains and ferries were cancelled amid warnings of a ""threat to life"".Network Rail Scotland said it was working to remove debris and trees from routes following the ""unprecedented"" storm.Anamber warningwas place to 23:00 BST for most of Scotland, as well as a yellow warning that also covers northern England, north Wales and Northern Ireland.Storm Floris is the sixth named storm of the 2024/25 season and the first since January.Wick in the Highlands saw winds of 82mph, the strongest gusts recorded since Storm Floris struck on Monday.Some mountain locations saw wind gusts over 100mph, but meteorologists focus on sites where very strong gusts are less usual and likely to have more impact.There were reports of trees and campervans toppling over in the hardest hit areas.Events including the Royal Edinburgh Military Tattoo and shows at Fringe by the Sea in North Berwick were also cancelled.The yellow warning will remain in place for the Northern Isles off the north coast of Scotland until 08:00 on Tuesday, and 23:59 on Monday for all other areas.On Tuesday the weather will be less windy but still blustery with showers across northern and central areas.Follow updates: Storm Floris bringing 'unseasonably strong' winds to parts of the UKAmber weather warnings in place for most of Scotland as Storm Floris sweeps inHow do storms like Floris get their names?Why does it always rain in the school summer holidays?Passengers in Scotland have been warned disruption to the rail network is likely to continue into Tuesday.Ross Moran, Network Rail Scotland's route director, said: ""Our teams have been working tirelessly to keep services moving where possible and to clear fallen trees and debris from the tracks.""Our teams will work through the night, but this work will continue into Tuesday morning.""It comes after Lnerwarned passengers not to travel north of Newcastle on Monday. Customers with tickets can use them until Wednesday.Scottish ferry operator CalMac issued a series of cancellation warnings and warned of disruption across its network.Most of Scotland's major road bridges closed to high-sided vehicles and motorists were urged to slow down in poor weather and avoid exposed Highland and coastal routes.Several shows at the Edinburgh Fringe Festival were cancelled as a ""precautionary"" measure, and flights were cancelled in Northern Ireland due to the storm.Meanwhile, postal services were affected by Floris meaning that some students in Scotland will have to wait until Tuesday to receive their SQA exam results.Strong winds hit the coastal town of Largs in North AyrshireAngela Constance, the Scottish secretary for home affairs, encouraged people to check on elderly or vulnerable neighbours during the storm, and warned those travelling on Monday to view it as ""a winter journey"" and take warm clothes.Jim Dale, a meteorologist and founder of independent forecaster British Weather Services, warned those in areas affected by the warnings: ""If you are venturing out, keep away from the forest, keep away from the woods, keep off the coastal plain.""Named storms in August are not that rare, with five taking place since 2020.Last year, Storm Lilian struck the UK on 23 August just before the bank holiday weekend, closing stages at the Leeds Festival and cancelling Heathrow flights.Storms Antoni and Betty brought disruption in 2023, while stormsEllenandFrancisin 2020 were described as ""two of the most notable August storms in the last 50 years"" by the Met Office.These two storms brought wind gusts of 79mph and 81mph respectively with transport disruption, coastal flooding and power cuts.The storm follows the UK's fifth warmest July on record, according to provisional figures from the Met Office.All four UK nations recorded one of their 10 warmest Julys, and July was the sixth consecutive month of above-average mean temperatures for the UK, the Met Office said.The first day of the month brought the highest temperature of the year so far, with 35.8C in Faversham, Kent.",unknown,2025-08-04T18:05:16.146608,storm flori batter wind mph minut agosharesaverachel muller heyndykbbc newselizabeth rizzinilead weather presentersharesavedamag disrupt storm flori crash uktravel disrupt expect continu tuesday storm flori batter part countri mph wind scotland brunt bad weather home power monday night plane train ferri cancel warn threat life network rail scotland work remov debri tree rout follow unpreced storm anamb warningwa place bst scotland yellow warn cover northern north wale northern ireland storm flori sixth name storm season januari wick highland saw wind mph gust record storm flori struck monday mountain locat saw wind gust mph meteorologist focu site strong gust usual like impact tree campervan toppl hit area event includ royal edinburgh militari tattoo show fring sea north berwick cancel yellow warn remain place northern isl coast scotland tuesday monday area tuesday windi blusteri shower northern central area follow updat storm flori bring strong wind part ukamb warn place scotland storm flori sweep storm flori get name rain school summer holiday passeng scotland warn disrupt rail network like continu tuesday ross moran network rail scotland rout director team work keep servic move possibl clear fallen tree debri track team work night work continu tuesday morn come lnerwarn passeng travel north newcastl monday custom ticket use wednesday scottish ferri oper calmac issu seri cancel warn warn disrupt network scotland major road bridg close side vehicl motorist urg slow poor weather avoid expos highland coastal rout sever show edinburgh fring festiv cancel precautionari measur flight cancel northern ireland due storm meanwhil postal servic affect flori mean student scotland wait tuesday receiv sqa exam result strong wind hit coastal town larg north ayrshireangela constanc scottish secretari home affair encourag peopl check elderli vulner neighbour storm warn travel monday view winter journey take warm cloth jim dale meteorologist founder independ forecast british weather servic warn area affect warn ventur keep forest keep wood keep coastal plain name storm august rare take place last year storm lilian struck august bank holiday weekend close stage leed festiv cancel heathrow flight storm antoni brought disrupt stormsellenandfrancisin describ notabl august storm last year met offic storm brought wind gust mph mph transport disrupt coastal flood power cut storm follow fifth juli record provision figur met offic nation record juli juli sixth consecut month averag mean temperatur met offic day month brought temperatur year faversham kent,"{""word_count"": 689, ""char_count"": 4430, ""sentence_count"": 6, ""avg_word_length"": 5.7109375, ""vocabulary_richness"": 0.5677083333333334, ""most_common_words"": [[""storm"", 18], [""warn"", 10], [""flori"", 9], [""scotland"", 9], [""wind"", 7], [""mph"", 6], [""disrupt"", 6], [""tuesday"", 6], [""cancel"", 6], [""monday"", 5]]}",689,6,0.5677083333333334
