title,description,link,published,source,content_type,full_content,category,processed_at,processed_tokens,text_features,word_count,sentence_count,vocab_richness
India brushes off Trump tariff threat over Russian oil,"India has pushed back against US President Donald Trump's threat to impose higher tariffs on Indian goods. New Delhi condemned Western criticism of its buying oil from Moscow, vowing to protect its national interests.",https://www.dw.com/en/india-brushes-off-trump-tariff-threat-over-russian-oil/a-73528185?maca=en-rss-en-all-1573-rdf,,https://rss.dw.com/rdf/rss-en-all,rss,"PoliticsIndiaIndia brushes off Trump tariff threat over Russian oilRichard Connorwith AFP, Reuters08/04/2025August 4, 2025India has pushed back against US President Donald Trump's threat to impose higher tariffs on Indian goods. New Delhi condemned Western criticism of its buying oil from Moscow, vowing to protect its national interests.https://p.dw.com/p/4yW2TThe country has historically bought most of its crude from the Middle East, but this has changedImage: BIJU BORO/AFPAdvertisementIndia on Monday denounced as unfair the mounting pressure from the United States and European Union over itscontinued purchases of Russian oil.Foreign Ministry spokesman Randhir Jaiswal said the country would safeguard its economic interests amid threats of steep tariffs from President Donald Trump.What did New Delhi say about trade with Russia?""The targeting of India is unjustified and unreasonable,"" said Jaiswal, asserting the country's sovereign right to secure energy supplies in line with its needs.""Like any major economy, India will take all necessary measures to safeguard its national interests and economic security,"" he added.Jaiswal also argued thatIndia's importsbegan only after Western countries diverted traditional supplies to Europe following the outbreak of the Ukraine war. He also accused both the EU and the US of hypocrisy.""It is revealing that the very nations criticizing India are themselves indulging in trade with Russia,""  Jaiswal said.""Unlike our case, such trade is not even a vital national compulsion.""Why sanctions won't stop RussiaTo view this video please enable JavaScript, and consider upgrading to a web browser thatsupports HTML5 videoJaiswal pointed to ongoing Europe-Russia trade involvingfertilizers, chemicals, iron and steel, machinery, and transport equipment.He also noted that the US continues to import Russian uranium hexafluoride for its nuclear industry, palladium for electric vehicles, and other industrial goods.What did Trump say about India and tariffs?US President Donald Trump has threatened to sharply increase tariffs on Indian goods, accusing New Delhi of profiting from discounted Russian oil while failing to support efforts to end the war in Ukraine.While Trump did not specify the exact rate, an existing 10% tariff on Indian products isexpected to rise to 25% starting Thursday.The move, he said, was in response to India ""buying massive amounts of Russian oil"" and reselling it for profit, which he claimed fuels Moscow’s war on Ukraine. ""They don't care how many people in Ukraine are being killed by the Russian War Machine,"" Trump wrote on Truth Social.The move adds strain to a key trade relationship. The US is India’s largest trading partner, with Indian exports to the US totaling $87.4 billion in 2024. India recorded a nearly $46 billion trade surplus with the US the same year.Azerbaijan edges away from Russia's orbit as rifts emergeTo view this video please enable JavaScript, and consider upgrading to a web browser thatsupports HTML5 videoEdited by: Wesley RahnRichard ConnorReporting on stories from around the world, with a particular focus on Europe — especially Germany.Send us your feedbackYour feedbackAdvertisement",unknown,2025-08-04T18:05:16.146608,politicsindiaindia brush trump tariff threat russian oilrichard connorwith afp august india push presid donald trump threat impos tariff indian good new delhi condemn western critic buy oil moscow vow protect nation interest countri bought crude middl east changedimag biju boro afpadvertisementindia monday denounc unfair mount pressur unit state european union itscontinu purchas russian oil foreign ministri spokesman randhir jaiswal countri safeguard econom interest threat steep tariff presid donald trump new delhi trade russia target india unjustifi unreason jaiswal assert countri sovereign right secur energi suppli line need major economi india take necessari measur safeguard nation interest econom secur ad jaiswal argu thatindia importsbegan western countri divert tradit suppli europ follow outbreak ukrain war accus hypocrisi reveal nation critic india indulg trade russia jaiswal case trade vital nation compuls sanction stop russiato view video pleas enabl javascript consid upgrad web browser thatsupport html videojaisw point ongo europ russia trade involvingfertil chemic iron steel machineri transport equip note continu import russian uranium hexafluorid nuclear industri palladium electr vehicl industri good india tariff presid donald trump threaten increas tariff indian good accus new delhi profit discount russian oil fail support effort end war ukrain trump specifi exact rate exist tariff indian product isexpect rise start thursday move respons india buy massiv amount russian oil resel profit claim fuel moscow war ukrain care mani peopl ukrain kill russian war machin trump wrote truth social move add strain key trade relationship india trade partner indian export total india record trade surplu year azerbaijan edg russia orbit rift emergeto view video pleas enabl javascript consid upgrad web browser thatsupport html videoedit wesley rahnrichard connorreport stori world particular focu europ germani send feedbackyour feedbackadvertis,"{""word_count"": 468, ""char_count"": 3199, ""sentence_count"": 11, ""avg_word_length"": 6.122743682310469, ""vocabulary_richness"": 0.6714801444043321, ""most_common_words"": [[""india"", 8], [""trade"", 7], [""trump"", 6], [""tariff"", 6], [""russian"", 6], [""indian"", 4], [""oil"", 4], [""nation"", 4], [""countri"", 4], [""jaiswal"", 4]]}",468,11,0.6714801444043321
Middle East: Hostage families criticize reported Israeli war plans,"After ceasefire talks between Israel and Hamas collapsed, PM Netanyahu is reportedly considering ""decisive"" military action in the enclave. Hostage families warn this could endanger their loved ones. DW has more.",https://www.dw.com/en/middle-east-hostage-families-criticize-reported-israeli-war-plans/live-73516951?maca=en-rss-en-all-1573-rdf,,https://rss.dw.com/rdf/rss-en-all,rss,"ConflictsMiddle EastMiddle East: Hostage families criticize Israeli war plansFelix TamsutAP, AFP, dpa, ReutersPublished 08/04/2025Published August 4, 2025last updated 08/04/2025last updated August 4, 2025After ceasefire talks between Israel and Hamas collapsed, PM Netanyahu is reportedly considering ""decisive"" military action in the enclave. Hostage families warn this could endanger their loved ones. DW has more.https://p.dw.com/p/4yT7HFamilies of hostages held in Gaza ave been holding regular protests in Tel AvivImage: Jack Guez/AFPAdvertisementSkip next section What you need to knowWhat you need to knowPrime Minister Benjamin Netanyahu is advocating for the release of hostages through a ""decisive military victory,"" Israeli media reported.It is a strategy that could see Israeli forces operating in areas believed to be controlled by Hamas, where hostages are suspected to be held.In response, the Hostages and Missing Families Forum, which represents the vast majority of hostage families, condemned the approach, stating that Netanyahu is ""leading Israel and the hostages toward devastation.""This blog is now closed. Here is more coverage ofdevelopments in the Middle East.Skip next section Petition calls for foreign press access to Gaza08/04/2025August 4, 2025Petition calls for foreign press access to GazaMore than 200 international journalists are calling on Israel to allow  ""immediate and unsupervised foreign press access to the Gaza Strip.""Launched by the Freedom to Report initiative, the petition criticizes Israeli-imposed restrictions on foreign reporting from the territory that ""silence independent observation.""It has been signed by many prominent journalists including Christiane Amanpour, Anderson Cooper, Clarissa Ward, and Mehdi Hassan.""When governments can unilaterally shut down access to war zones ... They undermine the very foundation of democracy: press freedom as a check on power,"" the petition reads.Some journalists have been allowed to enter Gaza with the Israeli military, butmost reporting from the enclave is being done by Palestinian journalistsliving there.Last month, the Associated Press, AFP, BBC News and Reuters published a joint statement that their journalists in Gaza were facing ""dire circumstances"" and were ""increasingly unable to feed themselves and their families.""Since the war began after the Oct. 7, 2023, Hamas terror attack on Israel, 186 journalists have been killed in Gaza and 90 have been imprisoned, according to the Committee to Protect Journalists.On Friday, dozens of members of the International News Safety Institute, a nonprofit group, issued a statement calling on Israel to allow journalists in Gaza who are facing starvation to leave the enclave, and for international reporters to be allowed entry.https://p.dw.com/p/4yW6kSkip next section Israeli cabinet to decide next steps in Gaza war08/04/2025August 4, 2025Israeli cabinet to decide next steps in Gaza warIsraeli Prime MinisterBenjamin Netanyahuwill convene a cabinet meeting later this week on how to proceed withthe war in Gaza.Netanyahu said the cabinet will meet to ""instruct the (army) on how to achieve the three war objectives we have set,"" with the three objectives being the defeat of Hamas, the release of the hostages held in the enclave and ""the promise that Gaza will no longer pose a threat to Israel.""Yesterday, hostage family members criticized Netanyahu for his intention to further expand the war inGaza, potentially putting hostages at risk, saying the Israeli leader would lead Israel and the hostages ""into destruction.""https://p.dw.com/p/4yV7kSkip next section WATCH: Netanyahu appeals to Red Cross to visit and aid hostages in Gaza08/04/2025August 4, 2025WATCH: Netanyahu appeals to Red Cross to visit and aid hostages in GazaGerhard ElfersIf Hamas grants access, Red Cross doctors could enter the area where Israeli hostages are held to provide medical care.The development follows the release of harrowing videos showing emaciated captives.However, Hamas says medical access depends on the opening of humanitarian corridors across the entire Gaza Strip.DW speaks with Sarah Davies from the ICRC about the proposed operation.Netanyahu appeals to Red Cross to aid hostages in GazaTo view this video please enable JavaScript, and consider upgrading to a web browser thatsupports HTML5 videohttps://p.dw.com/p/4yV8HSkip next section Israel calls for more global attention toward plight of hostages08/04/2025August 4, 2025Israel calls for more global attention toward plight of hostagesIsraeli Foreign Minister Gideon Saar on Monday said thehostages held in Gazashould be top of the global agenda.Saar was speaking to the press ahead of a trip to New York to take part in a special UN Security Council session about the hostages' situation.""The world must put an end to the phenomenon of kidnapping civilians,"" he said.""It must be front and center on the world stage,"" he added.Fifty Israeli hostages are still held by Palestinian militant gro",unknown,2025-08-04T18:05:16.146608,conflictsmiddl eastmiddl east hostag famili critic isra war plansfelix tamsutap afp dpa reuterspublish publish last updat last updat august ceasefir talk israel hama collaps consid decis militari action enclav hostag famili warn endang love one hostag held gaza ave hold regular protest tel avivimag jack guez next section need need knowprim minist benjamin advoc releas hostag decis militari victori isra media report strategi see isra forc oper area believ control hama hostag suspect held respons hostag miss famili forum repres vast major hostag famili condemn state netanyahu lead israel hostag devast blog close coverag ofdevelop middl east skip next section petit call foreign access gaza august petit call foreign access gazamor intern journalist call israel allow immedi unsupervis foreign access gaza strip launch initi petit critic isra impos restrict foreign report territori silenc independ observ sign mani promin journalist includ christian amanpour anderson cooper clarissa ward mehdi hassan govern shut access war zone undermin foundat democraci check power petit read journalist allow enter gaza isra militari butmost report enclav done palestinian journalistsliv last month afp publish joint statement journalist gaza face dire circumst unabl feed famili war began oct hama terror attack israel journalist kill gaza imprison committe protect journalist friday dozen member intern safeti institut nonprofit group issu statement call israel allow journalist gaza face starvat leav enclav intern report allow entri next section isra cabinet decid next step gaza war august isra cabinet decid next step gaza warisra prime ministerbenjamin conven cabinet meet week proceed withth war gaza netanyahu cabinet meet instruct armi achiev war object set object defeat hama releas hostag held enclav promis gaza pose threat israel yesterday hostag famili member critic netanyahu intent expand war ingaza put hostag risk say isra leader lead israel hostag destruct next section watch netanyahu appeal red cross visit aid hostag gaza august watch netanyahu appeal red cross visit aid hostag elfersif hama grant access red cross doctor enter area isra hostag held medic care develop follow releas harrow video show emaci captiv hama medic access depend open humanitarian corridor entir gaza strip speak sarah davi icrc propos oper netanyahu appeal red cross aid hostag gazato view video pleas enabl javascript consid upgrad web browser thatsupport html video next section israel call global attent plight hostag august israel call global attent plight hostagesisra foreign minist gideon saar monday thehostag held gazashould top global agenda saar speak trip new york take part special secur council session hostag situat world put end phenomenon kidnap civilian front center world stage ad fifti isra hostag held palestinian milit gro,"{""word_count"": 725, ""char_count"": 5000, ""sentence_count"": 14, ""avg_word_length"": 5.682352941176471, ""vocabulary_richness"": 0.5858823529411765, ""most_common_words"": [[""hostag"", 19], [""gaza"", 13], [""isra"", 10], [""israel"", 9], [""war"", 7], [""next"", 7], [""journalist"", 7], [""famili"", 6], [""hama"", 6], [""held"", 6]]}",725,14,0.5858823529411765
Elon Musk says he’s bringing back Vine — sort of.,"Elon Musk says he’s bringing back Vine — sort of. The X ownerannouncedover the weekend that the company discovered the video archive for the popular short-form video app, thought to have been deleted, and is working to restore user access.Vine — something of a precursor to today’s TikTok, but with o...",https://techcrunch.com/2025/08/04/elon-musk-says-hes-bringing-back-vines-archive/,2025-08-04T18:05:14.725587,https://techcrunch.com,web,"Elon Musk says he’s bringing back Vine — sort of. The X ownerannouncedover the weekend that the company discovered the video archive for the popular short-form video app, thought to have been deleted, and is working to restore user access.Vine — something of a precursor to today’s TikTok, but with only six-second-long looping videos — wasacquired by Twitter back in October 2012for $30 million to expand the social media platform’s video ambitions. Unfortunately for Vine creators and fans, the company fumbled the app’s potential and decided toshut down Vine in 2016by limiting all new uploads. The following year, it was fully discontinued, though auser archiveremained for a time.Despite no longer having an App Store presence, Vine still has a place in the internet’s collective cultural consciousness. Through online compilations of the best Vines uploaded to YouTube, and through the careers of numerous creators who got their start on Vine, the company lives on to some extent, and its content continues to be discovered by new generations.Musk himself seemed interested in bringing back Vine afteracquiring Twitter in October 2022. Ina poll postedon the social media app, he asked Twitter’s users, “Bring back Vine?” to which nearly 70% responded “yes.”Axios reported at the timethat Twitter had devoted some engineers to working on the Vine reboot, but nothing ever came of it.Grok Imagine is AI Vine!Btw, we recently found the Vine video archive (thought it had been deleted) and are working on restoring user access, so you can post them if you want.— Elon Musk (@elonmusk)August 2, 2025It’s unclear whether Musk has any ambitions for Vine beyond getting its archive back online, however. In the same post about restoring Vine, he also touted that Grok’s new video-creation feature, Grok Imagine, also available to X Premium+ subscribers, is “AI Vine.” That suggests that his interests in video creation no longer lie with human creativity, but in human-directed AI prompting.Whether or not Musk will actually deliver on the promise remains to be seen, as the X post could have just been another way to draw attention to Grok AI, rather than being representative of a real effort inside the company to make old Vines available for reposting.Techcrunch eventTech and VC heavyweights join the Disrupt 2025 agendaNetflix, ElevenLabs, Wayve, Sequoia Capital — just a few of the heavy hitters joining the Disrupt 2025 agenda. They’re here to deliver the insights that fuel startup growth and sharpen your edge. Don’t miss the 20th anniversary of TechCrunch Disrupt, and a chance to learn from the top voices in tech — grab your ticket now and save up to $675 before prices rise.Tech and VC heavyweights join the Disrupt 2025 agendaNetflix, ElevenLabs, Wayve, Sequoia Capital — just a few of the heavy hitters joining the Disrupt 2025 agenda. They’re here to deliver the insights that fuel startup growth and sharpen your edge. Don’t miss the 20th anniversary of TechCrunch Disrupt, and a chance to learn from the top voices in tech — grab your ticket now and save up to $675 before prices rise.San Francisco|October 27-29, 2025REGISTER NOW",unknown,2025-08-04T18:05:16.146608,elon musk bring vine sort weekend compani discov video archiv popular short form video app thought delet work restor user access vine someth precursor today tiktok second loop video wasacquir twitter octob expand social media platform video ambit vine creator fan compani fumbl potenti decid toshut vine limit new upload follow year discontinu auser archiveremain time app store presenc vine place internet collect cultur conscious onlin compil vine upload youtub career numer creator got start vine compani live extent content continu discov new gener musk seem interest bring vine afteracquir twitter octob ina poll postedon social media app ask twitter user bring vine respond axio report twitter devot engin work vine reboot noth came grok imagin vine btw found vine video archiv thought delet work restor user access post want elon musk musk ambit vine get archiv onlin restor vine tout grok new video creation featur grok imagin avail premium subscrib vine suggest interest video creation lie human creativ human direct prompt musk promis remain seen post way draw attent grok repres real effort compani make old vine avail repost techcrunch eventtech heavyweight join disrupt agendanetflix elevenlab wayv sequoia capit heavi hitter join disrupt agenda deliv insight fuel startup growth sharpen edg miss anniversari techcrunch disrupt chanc learn top voic tech grab ticket save price rise tech heavyweight join disrupt agendanetflix elevenlab wayv sequoia capit heavi hitter join disrupt agenda deliv insight fuel startup growth sharpen edg miss anniversari techcrunch disrupt chanc learn top voic tech grab ticket save price rise san francisco octob regist,"{""word_count"": 509, ""char_count"": 3147, ""sentence_count"": 11, ""avg_word_length"": 5.525490196078431, ""vocabulary_richness"": 0.5843137254901961, ""most_common_words"": [[""vine"", 16], [""video"", 7], [""disrupt"", 6], [""musk"", 5], [""compani"", 4], [""twitter"", 4], [""grok"", 4], [""join"", 4], [""bring"", 3], [""archiv"", 3]]}",509,11,0.5843137254901961
"Amazon is denying that it’s shutting down Wondery, the podcast studio itacquired in late 2020, after","Amazon is denying that it’s shutting down Wondery, the podcast studio itacquired in late 2020, afterBloomberg reportedon Monday that the company was closing the studio and cutting 110 jobs.Amazon told TechCrunch that Wondery will continue to develop creator-led podcasts under the Wondery brand withi...",https://techcrunch.com/2025/08/04/amazon-denies-report-its-shutting-down-wondery-podcast-studio/,2025-08-04T18:05:15.632849,https://techcrunch.com,web,"Amazon is denying that it’s shutting down Wondery, the podcast studio itacquired in late 2020, afterBloomberg reportedon Monday that the company was closing the studio and cutting 110 jobs.Amazon told TechCrunch that Wondery will continue to develop creator-led podcasts under the Wondery brand within a new team. What’s changing is that the company is separating the teams that oversee Wondery’s narrative podcast efforts from those developing its creator-led shows.Wondery is combining its narrative podcast studio, which includes podcasts like Dr. Death and American Scandal, with Audible.“The podcast landscape has evolved significantly in the past few years, particularly with the rise of video-forward, creator-led content,” Amazon said in an emailed statement.“These changes reflect that evolution and will streamline how Wondery integrates further into Amazon. By making these changes, we can better support creators in monetizing their content across multiple channels, help them expand their brand IP, and simplify the process for advertisers while making content more accessible to audiences wherever they prefer to consume it. This evolution builds on Wondery’s early success with video-forward shows and positions us to better serve creators, customers, and advertisers.”Despite securing big names in the business, the company is now shifting its strategy in an effort to better compete with rivals like Spotify and YouTube as the podcasting industry embraces video formats.Update: The article was updated to reflect that Amazon denied reports of Wondery shutting down.Techcrunch eventTech and VC heavyweights join the Disrupt 2025 agendaNetflix, ElevenLabs, Wayve, Sequoia Capital — just a few of the heavy hitters joining the Disrupt 2025 agenda. They’re here to deliver the insights that fuel startup growth and sharpen your edge. Don’t miss the 20th anniversary of TechCrunch Disrupt, and a chance to learn from the top voices in tech — grab your ticket now and save up to $675 before prices rise.Tech and VC heavyweights join the Disrupt 2025 agendaNetflix, ElevenLabs, Wayve, Sequoia Capital — just a few of the heavy hitters joining the Disrupt 2025 agenda. They’re here to deliver the insights that fuel startup growth and sharpen your edge. Don’t miss the 20th anniversary of TechCrunch Disrupt, and a chance to learn from the top voices in tech — grab your ticket now and save up to $675 before prices rise.San Francisco|October 27-29, 2025REGISTER NOW",unknown,2025-08-04T18:05:16.146608,amazon deni shut wonderi podcast studio itacquir late afterbloomberg reportedon monday compani close studio cut job amazon techcrunch wonderi continu develop creator led podcast wonderi brand new team chang compani separ team overse wonderi narr podcast effort develop creator led show wonderi combin narr podcast studio includ podcast death american scandal audibl podcast landscap evolv past year rise creator led content amazon email statement chang reflect evolut streamlin wonderi integr make chang support creator monet content multipl channel help expand brand simplifi process advertis make content access audienc prefer consum evolut build wonderi earli success video show posit serv creator custom advertis secur big name busi compani shift strategi effort compet rival spotifi youtub podcast industri embrac video format updat articl updat reflect amazon deni wonderi shut techcrunch eventtech heavyweight join disrupt agendanetflix elevenlab wayv sequoia capit heavi hitter join disrupt agenda deliv insight fuel startup growth sharpen edg miss anniversari techcrunch disrupt chanc learn top voic tech grab ticket save price rise tech heavyweight join disrupt agendanetflix elevenlab wayv sequoia capit heavi hitter join disrupt agenda deliv insight fuel startup growth sharpen edg miss anniversari techcrunch disrupt chanc learn top voic tech grab ticket save price rise san francisco octob regist,"{""word_count"": 377, ""char_count"": 2475, ""sentence_count"": 8, ""avg_word_length"": 5.985148514851486, ""vocabulary_richness"": 0.5792079207920792, ""most_common_words"": [[""wonderi"", 8], [""podcast"", 7], [""disrupt"", 6], [""creator"", 5], [""amazon"", 4], [""techcrunch"", 4], [""join"", 4], [""studio"", 3], [""compani"", 3], [""led"", 3]]}",377,8,0.5792079207920792
